Title,Price,Link
Quần Jogger Thể Thao Nam Trơn Chất Gió Dù Mềm Mịn,149.000 ₫,https://tiki.vn/quan-jogger-the-thao-nam-tron-chat-gio-du-mem-min-p82528842.html?spid=82528852
Quần Nam Quần Đũi Dài Nam Ống Suông Form Slimfit Dáng Âu,100.000 ₫,https://tiki.vn/quan-nam-quan-dui-dai-nam-ong-suong-form-slimfit-dang-au-p122069831.html?spid=122070056
Combo 5 Quần Đùi May 10,125.000 ₫,https://tiki.vn/combo-5-quan-dui-may-10-p67538621.html?spid=67538623
Quần Jogger Kaki Nam Phong Cách Lính New Arrival 05,175.000 ₫,https://tiki.vn/quan-jogger-kaki-nam-phong-cach-linh-new-arrival-05-p21972366.html?spid=40741159
"Quần Short Gió Thể Thao Nam 5S (Qsg002S1-02) Trẻ Trung, Năng Động, Nam Tính",127.500 ₫,https://tiki.vn/quan-short-gio-the-thao-nam-5s-qsg002s1-02-tre-trung-nang-dong-nam-tinh-p67185999.html?spid=67186001
"Quần Ống Suông Nam, Quần Ống Rộng Nam Vải Hàn Quốc Tilaa Fashion Qb06",145.000 ₫,https://tiki.vn/quan-ong-suong-nam-quan-ong-rong-nam-vai-han-quoc-tilaa-fashion-qb06-p137741947.html?spid=137741989
Quần Jogger 1 Sọc - Quần 1 Line Bo Nỉ Thun Nam Nữ Phong Cách Hàn Quốc Vải Dày Mịn Unisex,95.000 ₫,https://tiki.vn/quan-jogger-1-soc-quan-1-line-bo-ni-thun-nam-nu-phong-cach-han-quoc-vai-day-min-unisex-p39158901.html?spid=47330003
Quần Jogger Kaki Nam Túi Hộp New Arrival 04,109.000 ₫,https://tiki.vn/quan-jogger-kaki-nam-tui-hop-new-arrival-04-p21971799.html?spid=108002551
Quần Jogger Nam Thể Thao - Quần Nỉ Nam Lót Lông Cao Cấp Chính Hãng Amalife,172.000 ₫,https://tiki.vn/quan-ni-lot-long-nam-quan-jogger-giu-nhiet-chinh-hang-amalife-p42424755.html?spid=47321082
Quần Jogger Kaki Nam,70.900 ₫,https://tiki.vn/quan-jogger-kaki-nam-p49268988.html?spid=58571876
Quần Túi Hộp Tháo Ống Us Army U880 Chuyên Phượt Chất Vải Gió Cao Cấp Mau Khô Ống Có Thể Tháo Rời Làm Quần Short -Hàng Chính Hãng,359.000 ₫,https://tiki.vn/quan-tui-hop-thao-ong-us-army-u880-chuyen-phuot-chat-vai-gio-cao-cap-mau-kho-ong-co-the-thao-roi-lam-quan-short-hang-chinh-hang-p111972654.html?spid=111972658
"Quần Bò, Jean Baggy Nam, Xanh + Đen, Ống Suông Rộng Tr01, Style Hàn Quốc",149.000 ₫,https://tiki.vn/quan-bo-jean-baggy-nam-xanh-den-ong-suong-rong-tr01-style-han-quoc-p110750806.html?spid=110750868
"Quần Thể Thao Jogger Nam 5S (5 Màu), Chất Vải Gió Cao Cấp, Siêu Nhẹ, Chống Nhăn, Giữ Ấm Tốt (Qgd21014)",229.000 ₫,https://tiki.vn/quan-the-thao-jogger-nam-5s-5-mau-chat-vai-gio-cao-cap-sieu-nhe-chong-nhan-giu-am-tot-qgd21014-p128939142.html?spid=128939160
Quần Jogger Nam Thun Nỉ Ống Bó Có Big Size,68.000 ₫,https://tiki.vn/quan-jogger-ni-nam-tron-p29115771.html?spid=59073600
"Quần Dài Túi Hộp Nam Nữ E'Mer , Quần Suông Ống Rộng Kaki Form Rộng Unisex",179.000 ₫,https://tiki.vn/quan-dai-tui-hop-nam-nu-e-mer-quan-suong-ong-rong-kaki-form-rong-unisex-p124944273.html?spid=124944291
"Quần Đũi Thái,Quần Đũi Dài Nam Cạp Thun Siêu Đẹp",150.000 ₫,https://tiki.vn/quan-dui-thai-quan-dui-dai-nam-cap-thun-sieu-dep-p122069534.html?spid=122069863
Quần Jogger Kaki Nam Mk Clever Qjkb078,180.000 ₫,https://tiki.vn/quan-jogger-kaki-nam-mk-clever-qjkb078-p116394591.html?spid=116394791
Quần Jogger Vải Kaki Nam Nữ,109.000 ₫,https://tiki.vn/quan-jogger-vai-kaki-nam-nu-p98668394.html?spid=98668532
Quần Thể Thao Nam Jogger Kaki Mã Tt33 Thô Túi Hộp Kiểu Bó Ống Hàn Quốc Chất Vải Đẹp Ống Dài,103.000 ₫,https://tiki.vn/quan-the-thao-nam-jogger-kaki-ma-tt33-tho-tui-hop-kieu-bo-ong-han-quoc-chat-vai-dep-ong-dai-p74238547.html?spid=74544000
Quần Nam Quần Đũi Dài Nam Ống Suông Form Slimfit Dáng Âu,150.000 ₫,https://tiki.vn/quan-nam-quan-dui-dai-nam-ong-suong-form-slimfit-dang-au-p122069743.html?spid=122070171
Quần Thể Thao Nam -Quần Jogger Nam Chất Umi Loại 1 Da Cao Cấp,149.000 ₫,https://tiki.vn/quan-the-thao-nam-quan-jogger-nam-chat-umi-loai-1-da-cao-cap-p141982305.html?spid=141982402
Quần Ống Rộng Kẻ Caro Nam Nữ - Quần Vải Unisex- Năng Động Thoải Mái - Đổi Trả Free Nếu Không Ưng Hoặc Hàng Lỗi,79.000 ₫,https://tiki.vn/quan-ong-rong-ke-caro-nam-nu-quan-vai-unisex-nang-dong-thoai-mai-doi-tra-free-neu-khong-ung-hoac-hang-loi-p94808227.html?spid=117008205
Quần Short Kaki Nam Co Giãn Cao Cấp Lưng Thun Bt01,99.000 ₫,https://tiki.vn/quan-short-kaki-nam-co-gian-cao-cap-lung-thun-bt01-p32386665.html?spid=32386705
Quần Jogger Kaki Nam Dáng Hàn Siêu Đẹp,87.500 ₫,https://tiki.vn/quan-jogger-kaki-nam-dang-han-sieu-dep-p117599354.html?spid=117599413
Quần Nam DàI Chất Đũi Mềm Mại,89.000 ₫,https://tiki.vn/quan-nam-da-i-chat-dui-mem-mai-p93050507.html?spid=93050704
Quần Nam Kaki Basic Dáng Baggy Trơn Màu Phong Cách Trẻ Trung Thời Trang Zenkonu Quan Nam 1000060V1,79.000 ₫,https://tiki.vn/quan-nam-kaki-basic-dang-baggy-tron-mau-phong-cach-tre-trung-thoi-trang-zenkonu-quan-nam-1000060v1-p111670297.html?spid=111671779
Quần Thun Đen Ống Rộng Nam Phong Cách Hàn Quốc - Vải Co Giãn Tốt,49.000 ₫,https://tiki.vn/product-p91007411.html?spid=145784081
Quần Jogger Kaki Nam Phong Cách Trẻ Trung Năng Động Thời Trang Vicero,119.000 ₫,https://tiki.vn/quan-jogger-kaki-nam-phong-cach-tre-trung-nang-dong-thoi-trang-vicero-p37580438.html?spid=37580459
Quần Jogger Thun Poly Thể Thao Thời Trang Nam 2021,175.000 ₫,https://tiki.vn/quan-jogger-thun-poly-the-thao-thoi-trang-nam-2021-p127314072.html?spid=127314108
Quần Nam Trơn Bo Gấu Basic Phối Dây Rút Phong Cách Trẻ Trung Thời Trang Zenkonu Quan Nam 1000067V1,59.000 ₫,https://tiki.vn/quan-nam-tron-bo-gau-basic-phoi-day-rut-phong-cach-tre-trung-thoi-trang-zenkonu-quan-nam-1000067v1-p111667836.html?spid=111668151
Quần Jogger Thể Thao Quần Tập Gym Nam 3 Sọc Dài Q-01,69.000 ₫,https://tiki.vn/quan-jogger-the-thao-quan-tap-gym-nam-3-soc-dai-q-01-p67656086.html?spid=71000671
Quần Jogger Kaki Nam Chất Mát - Rằn Ri T06,70.800 ₫,https://tiki.vn/quan-jogger-kaki-nam-chat-mat-ran-ri-t06-p6982965.html?spid=48749005
"Quần Short Gió Thể Thao Nam 5S (Qsg001S1) Trẻ Trung, Năng Động Hàng Công Ty Chính Hãng",127.500 ₫,https://tiki.vn/quan-short-gio-the-thao-nam-5s-qsg001s1-tre-trung-nang-dong-hang-cong-ty-chinh-hang-p54726271.html?spid=54726277
Quần Jogger Unisex  Quần Ống Rộng- Quần Dài Thể Thao Nam Nữ Chất Vải Umi Xịn Mịn,114.000 ₫,https://tiki.vn/quan-jogger-unisex-quan-ong-rong-quan-dai-the-thao-nam-nu-chat-vai-umi-xin-min-p123926898.html?spid=123927043
"Quần Jean Nam 5S (3 Màu) Cơ Bản, Chất  Cotton Cực Mềm Mại, Co Giãn Tốt, Không Bai Xù, Bền Màu, Phom Trẻ Trung (Qbd)",369.000 ₫,https://tiki.vn/quan-jean-nam-5s-3-mau-co-ban-chat-cotton-cuc-mem-mai-co-gian-tot-khong-bai-xu-ben-mau-phom-tre-trung-qbd-p145367918.html?spid=145367936
Quần Jogger Nam Kaki Thời Trang 4 Màu Phong Cách Thể Thao Vicero,119.000 ₫,https://tiki.vn/quan-jogger-nam-kaki-thoi-trang-4-mau-phong-cach-the-thao-vicero-p81602950.html?spid=81602960
"Quần Jogger Kaki Nam Faja Phong Cách Thể Thao, Trẻ Trung - Màu Xanh Rêu",85.000 ₫,https://tiki.vn/quan-jogger-kaki-nam-faja-phong-cach-the-thao-tre-trung-mau-xanh-reu-p16759148.html?spid=16759165
Quần Nam Vải Kaki Phong Cách Jogger Thoáng Mát Cao Cấp-Qb057,72.000 ₫,https://tiki.vn/quan-nam-vai-kaki-phong-cach-jogger-thoang-mat-cao-cap-qb057-p56002837.html?spid=68388751
Quần Jogger Nỉ Nam Thời Trang Thu Đông,55.000 ₫,https://tiki.vn/quan-jogger-ni-nam-thoi-trang-thu-dong-p67453594.html?spid=72092719
Quần Jogger Jean Nam Mẫu Mới Phong Cách 2021,278.000 ₫,https://tiki.vn/quan-jogger-jean-nam-mau-moi-phong-cach-2021-p120342859.html?spid=120343086
"Quần Thể Thao Nam, Quần Jogger Nỉ Thun Trơn Nam Nữ, Quần Nỉ Trơn Nam Nữ, Quần Nỉ 3 Sọc",68.000 ₫,https://tiki.vn/quan-the-thao-nam-quan-jogger-ni-thun-tron-nam-nu-quan-ni-tron-nam-nu-quan-ni-3-soc-p113063601.html?spid=113063675
"QuầN ĐùI Short Gió Nam Thể Thao Basic Trẻ Trung Năng ĐộNg, ThoáNg MáT Co GiãN 4 ChiềU Mrm Manlywear",139.000 ₫,https://tiki.vn/qua-n-du-i-short-gio-nam-the-thao-basic-tre-trung-nang-do-ng-thoa-ng-ma-t-co-gia-n-4-chie-u-mrm-manlywear-p99958075.html?spid=99958281
Quần Jogger Thun Sọc Caro Dài Nam Nữ Unisex Ống Suông Màu Xanh Đen,89.000 ₫,https://tiki.vn/quan-jogger-thun-soc-caro-dai-nam-nu-unisex-ong-suong-mau-xanh-den-p93710743.html?spid=114537106
Quần Nỉ Nam Jogger (Hè-Đông),50.000 ₫,https://tiki.vn/quan-ni-nam-jogger-he-dong-p67405774.html?spid=67405786
Quần Đùi Thun Thể Thao Nam Mát Lạnh Cao Cấp,38.000 ₫,https://tiki.vn/quan-dui-thun-the-thao-nam-mat-lanh-cao-cap-p53789518.html?spid=53789544
Quần Nam Jogger Sweatpants Thương Hiệu Coolmate,279.000 ₫,https://tiki.vn/quan-nam-jogger-sweatpants-thuong-hieu-coolmate-p137223121.html?spid=137223157
Quần Nam DàI Chất Đũi Mềm Mại,89.000 ₫,https://tiki.vn/quan-nam-da-i-chat-dui-mem-mai-p93050645.html?spid=93050657
"Quần Thể Thao Ống Rộng,Quần Jogger,Quần Thể Thao Nam Ống Rộng,Quần Thể Thao Nữ Rộng Unisex Qt1",117.000 ₫,https://tiki.vn/quan-the-thao-ong-rong-quan-jogger-quan-the-thao-nam-ong-rong-quan-the-thao-nu-rong-unisex-qt1-p71979929.html?spid=102269045
